<?xml version="1.0" encoding="UTF-8"?>
<Stylesheets id="uni.hd.cag" xmlns="http://www.idyria.com/osi/docbook/stylesheets" xmlns:xsi="http://www.w3.org/2001/XMLSchema-instance" xsi:schemaLocation="http://www.idyria.com/osi/docbook/stylesheets ../docbook/src/main/java/uni/hd/cag/eclipse/tools/docbook/stylesheets/stylesheets.xsd ">
  <Description>Stylesheets from CAG</Description>
  <Stylesheet path="./spec-xsl/html/spec-root.xsl" name="specification-html">
    <Description>Description</Description>
    <Output>
    	<Path>html</Path>
    	<File>css/spec-default.css</File>
    	<File>js/</File>
    </Output>
  </Stylesheet>
</Stylesheets>
