<?xml version="1.0" encoding="UTF-8"?>
<Stylesheets id="uni.hd.cag"
	xmlns="http://www.idyria.com/osi/docbook/stylesheets" xmlns:xsi="http://www.w3.org/2001/XMLSchema-instance"
	xsi:schemaLocation="http://www.idyria.com/osi/docbook/stylesheets ../docbook/src/main/java/uni/hd/cag/eclipse/tools/docbook/stylesheets/stylesheets.xsd ">
	<Description>Stylesheets from CAG</Description>
	<Stylesheet name="specification-html">
		<Description>Description</Description>
		<TransformChain>
			<Stylesheet>./spec-xsl/html/spec-root.xsl</Stylesheet>
		</TransformChain>
		<Output>
			<Path>html</Path>
			<File>css/spec-default.css</File>
			<File>js/</File>
		</Output>
	</Stylesheet>
	<Stylesheet name="specification-pdf">
		<Description>Description</Description>
		<TransformChain>
			<Stylesheet>./spec-xsl/common/spec-validation.xsl</Stylesheet>
			<Stylesheet>./spec-xsl/xsl-fo/spec-root-fo.xsl</Stylesheet>
		</TransformChain>
		<Output>
			<Path>pdf</Path>
			<File>fop.xconf</File>
			<File>log4j.xml</File>
		</Output>
		<PostProcessing>
			<Command>$repositoryPath$/../external/apache-fop/transformToPDF $outputFile$ $outputFileFolder$ $outputFileName$.pdf</Command>
		</PostProcessing>
	</Stylesheet>
	<Stylesheet name="validation-tcl">
		<Description>Generate TCL code from a validation process</Description>
		<TransformChain>
			<Stylesheet>./validation/validation-tcl.xsl</Stylesheet>
		</TransformChain>
		<Output>
			<Path>validation-tcl</Path>
		</Output>
	</Stylesheet>
</Stylesheets>
